{
  "schema_version": 1,
  "id": "TASK-0001",
  "title": "Implement feature A",
  "status": "doing",
  "owner_role": "dev",
  "created_at": "2026-01-01T10:00:00Z",
  "updated_at": "2026-01-02T10:00:00Z",
  "transitions": [
    {
      "at": "2026-01-01T11:00:00Z",
      "from": "todo",
      "to": "doing",
      "role": "dev"
    }
  ]
}
